{
  "$schema": "./KnownFailures.schema.json",
  "metadata": {
    "document_id": "known_failures.json",
    "title": "Known Failures",
    "source_format": "json",
    "document_authority": "invariant_authority_object"
  },
  "purpose": "Track recurring failure patterns later sessions should detect earlier.",
  "usage_rules": [
    "This is not a bug dump and not a decision log.",
    "Add an entry when a failure recurs, spreads, or exposes a harness weakness.",
    "Keep entries short and searchable.",
    "Link to evidence in implementation-project files when available.",
    "Do not record blame, moods, or one-off noise.",
    "Promote repeatable prevention into tooling or runtime rules when possible."
  ],
  "entries_schema_ref": "./KnownFailureEntry.schema.json",
  "entries": []
}
